<?xml version="1.0" encoding="UTF-8" standalone="yes"?>
<xs:schema version="1.0"
           xmlns:xs="http://www.w3.org/2001/XMLSchema"
           xmlns="http://www.piggsoft.com/redis"
           targetNamespace="http://www.piggsoft.com/redis"
           elementFormDefault="qualified">

    <xs:element name="configuration" type="config"/>

    <xs:element name="host" type="host"/>

    <xs:complexType name="config">
        <xs:sequence>
            <xs:element name="isSharding" type="xs:boolean" minOccurs="0" maxOccurs="1"/>
            <xs:element name="isCluster" type="xs:boolean" minOccurs="0" maxOccurs="1"/>
            <xs:element name="maxTotal" type="xs:int" minOccurs="0" maxOccurs="1"/>
            <xs:element name="maxIdle" type="xs:int" minOccurs="0" maxOccurs="1"/>
            <xs:element name="maxWaitMillis" type="xs:long" minOccurs="0" maxOccurs="1"/>
            <xs:element name="testOnBorrow" type="xs:boolean" minOccurs="0" maxOccurs="1"/>
            <xs:element name="minIdle" type="xs:int" minOccurs="0" maxOccurs="1"/>
            <xs:element name="hosts" minOccurs="1" maxOccurs="1">
                <xs:complexType>
                    <xs:sequence>
                        <xs:element ref="host" minOccurs="1" maxOccurs="unbounded"/>
                    </xs:sequence>
                </xs:complexType>
            </xs:element>
        </xs:sequence>
    </xs:complexType>

    <xs:complexType name="host">
        <xs:sequence>
            <xs:element name="url" type="xs:string" minOccurs="1" maxOccurs="1"/>
            <xs:element name="port" type="xs:int" minOccurs="0" maxOccurs="1"/>
            <xs:element name="timeout" type="xs:int" minOccurs="0" maxOccurs="1"/>
        </xs:sequence>
    </xs:complexType>
</xs:schema>

