<?xml version="1.0" encoding="UTF-8" ?>
<configuration
        xmlns="http://www.piggsoft.com/redis"
        xmlns:xsi="http://www.w3.org/2001/XMLSchema-instance"
        xsi:schemaLocation="http://www.piggsoft.com/redis http://www.piggsoft.com/redis.xsd">
    <!--是否是分片-->
    <isSharding>true</isSharding>
    <!--是否是集群， 集群和分片只能有一个为true，但都可为false-->
    <isCluster>false</isCluster>
    <hosts>
        <host>
            <url>172.16.16.185</url>
            <port>6379</port>
        </host>
        <host>
            <url>172.31.3.38</url>
            <port>6379</port>
        </host>
    </hosts>
</configuration>